uid,title,abstract,year,venue,authors,doi,arxiv_id,url,source,query,query_role,family,advisor_seed,citation_count,matched_terms,retrieved_at,relevance_score,hostile_score
doi:10.3390/robotics11060126,Learning from Demonstrations in Human–Robot Collaborative Scenarios: A Survey,"Human–Robot Collaboration (HRC) is an interdisciplinary research area that has gained attention within the smart manufacturing context. To address changes within manufacturing processes, HRC seeks to combine the impressive physical capabilities of robots with the cognitive abilities of humans to design tasks with high efficiency, repeatability, and adaptability. During the implementation of an HRC cell, a key activity is the robot programming that takes into account not only the robot restrictions and the working space, but also human interactions. One of the most promising techniques is the so-called Learning from Demonstration (LfD), this approach is based on a collection of learning algorithms, inspired by how humans imitate behaviors to learn and acquire new skills. In this way, the programming task could be simplified and provided by the shop floor operator. The aim of this work is ",2022,Robotics,Arturo Daniel Sosa-Ceron; Hugo Gustavo Gonzalez-Hernandez; Jorge Antonio Reyes-Avendaño,10.3390/robotics11060126,,https://doi.org/10.3390/robotics11060126,crossref,learning robot manipulation from human video,concept,human_data,,35,robot manipulation,2026-06-12T15:07:36Z,19.492,19.492
doi:10.1002/aisy.202400333,Biomechanics‐Based User‐Adaptive Variable Impedance Control for Enhanced Physical Human–Robot Interaction Using Bayesian Optimization,"This paper presents a biomechanics‐based, user‐adaptive variable impedance controller designed to enhance the performance of coupled human–robot systems during motion. The controller integrates the biomechanical characteristics of human limbs and dynamically adjusts the robotic impedance parameters—specifically damping, stiffness, and equilibrium trajectory—based on real‐time estimations of the user's intent and direction of motion. The primary goal is to minimize the energy expenditure of the coupled human–robot system while maintaining system passivity. To address uncertainties in human behavior and noisy observations, the controller employs Bayesian optimization combined with a Gaussian process. To validate the proposed approach, human experiments are conducted using a standard robotic arm manipulator. The results demonstrate that the controller eliminates the need for manual paramete",2024,Advanced Intelligent Systems,Fatemeh Zahedi; Hyunglae Lee,10.1002/aisy.202400333,,https://doi.org/10.1002/aisy.202400333,openalex,energy based policy robotics,concept,ebm,,6,impedance control; human robot interaction,2026-06-12T18:05:07Z,19.473,19.473
arxiv:2307.05959v1,Giving Robots a Hand: Learning Generalizable Manipulation with Eye-in-Hand Human Video Demonstrations,"Eye-in-hand cameras have shown promise in enabling greater sample efficiency and generalization in vision-based robotic manipulation. However, for robotic imitation, it is still expensive to have a human teleoperator collect large amounts of expert demonstrations with a real robot. Videos of humans performing tasks, on the other hand, are much cheaper to collect since they eliminate the need for expertise in robotic teleoperation and can be quickly captured in a wide range of scenarios. Therefore, human video demonstrations are a promising data source for learning generalizable robotic manipulation policies at scale. In this work, we augment narrow robotic imitation datasets with broad unlabeled human video demonstrations to greatly enhance the generalization of eye-in-hand visuomotor policies. Although a clear visual domain gap exists between human and robot data, our framework does not",2023,arXiv,Moo Jin Kim; Jiajun Wu; Chelsea Finn,,2307.05959v1,http://arxiv.org/abs/2307.05959v1,arxiv,learning robot manipulation from human video,concept,human_data,,,robot manipulation; teleoperation; generalization; partial observability; sample efficiency,2026-06-12T14:45:03Z,19.450,20.450
doi:10.1109/tro.2021.3121610,"Low-Impedance Displacement Sensors for Intuitive Physical Human–Robot Interaction: Motion Guidance, Design, and Prototyping",,2022,IEEE Transactions on Robotics,Thierry Laliberte; Clement Gosselin,10.1109/tro.2021.3121610,,https://doi.org/10.1109/tro.2021.3121610,crossref,robotics,concept,crossref_bulk_robotics,,16,human robot interaction,2026-06-12T19:29:26Z,19.417,19.417
doi:10.1109/wacv57701.2024.00189,Active Transfer Learning for Efficient Video-Specific Human Pose Estimation,,2024,2024 IEEE/CVF Winter Conference on Applications of Computer Vision (WACV),Hiromu Taketsugu; Norimichi Ukita,10.1109/wacv57701.2024.00189,,https://doi.org/10.1109/wacv57701.2024.00189,crossref,learning robot manipulation from human video,concept,human_data,,6,robot manipulation,2026-06-12T15:07:36Z,19.373,19.373
doi:10.1007/s10514-020-09934-9,A dynamical system approach for detection and reaction to human guidance in physical human–robot interaction,"Abstract A seamless interaction requires two robotic behaviors: the leader role where the robot rejects the external perturbations and focuses on the autonomous execution of the task, and the follower role where the robot ignores the task and complies with human intentional forces. The goal of this work is to provide (1) a unified robotic architecture to produce these two roles, and (2) a human-guidance detection algorithm to switch across the two roles. In the absence of human-guidance, the robot performs its task autonomously and upon detection of such guidances the robot passively follows the human motions. We employ dynamical systems to generate task-specific motion and admittance control to generate reactive motions toward the human-guidance. This structure enables the robot to reject undesirable perturbations, track the motions precisely, react to human-guidance by providing proper",2020,Autonomous Robots,Mahdi Khoramshahi; Aude Billard,10.1007/s10514-020-09934-9,,https://doi.org/10.1007/s10514-020-09934-9,crossref,Gaussian splatting robot perception multi robot system,concept,architecture_x_embodiment,,27,Gaussian splatting robot perception; multi robot system; human robot interaction,2026-06-12T15:07:36Z,19.316,19.316
doi:10.1109/access.2023.3296252,ViCo-MoCo-DL: Video Coding and Motion Compensation Solutions for Human Activity Recognition Using Deep Learning,,2023,IEEE Access,Tamer Shanableh,10.1109/access.2023.3296252,,https://doi.org/10.1109/access.2023.3296252,crossref,learning robot manipulation from human video,concept,human_data,,8,robot manipulation,2026-06-12T15:07:36Z,19.299,19.299
doi:10.1145/3354139,Learning the Correct Robot Trajectory in Real-Time from Physical Human Interactions,"We present a learning and control strategy that enables robots to harness physical human interventions to update their trajectory and goal during autonomous tasks. Within the state of the art, the robot typically reacts to physical interactions by modifying a local segment of its trajectory, or by searching for the global trajectory offline, using either replanning or previous demonstrations. Instead, we explore a one-shot approach: here, the robot updates its entire trajectory and goal in real time without relying on multiple iterations, offline demonstrations, or replanning. Our solution is grounded in optimal control and gradient descent, and extends linear-quadratic regulator controllers to generalize across methods that locally or globally modify the robot’s underlying trajectory. In the best case, this Linear-quadratic regulator + Learning approach matches the optimal offline respo",2020,ACM Transactions on Human-Robot Interaction,Dylan P. Losey; Marcia K. O'Malley,10.1145/3354139,,https://doi.org/10.1145/3354139,crossref,learning robot manipulation from human video,concept,human_data,,26,robot manipulation,2026-06-12T14:45:03Z,19.298,20.298
doi:10.1007/s00521-024-09428-0,Decentralized variable impedance control of modular robot manipulators with physical human–robot interaction using Gaussian process-based motion intention estimation,,2024,Neural Computing and Applications,Bo Dong; Shijie Li; Tianjiao An; Yiming Cui; Xinye Zhu,10.1007/s00521-024-09428-0,,https://doi.org/10.1007/s00521-024-09428-0,crossref,Gaussian splatting robot perception,concept,architecture,,5,Gaussian splatting robot perception; impedance control; human robot interaction,2026-06-12T15:07:36Z,19.296,19.296
doi:10.1109/urai.2015.7358837,Incremental robot skill learning by human motion retargetting and physical human guidance,,2015,2015 12th International Conference on Ubiquitous Robots and Ambient Intelligence (URAI),Dongheui Lee,10.1109/urai.2015.7358837,,https://doi.org/10.1109/urai.2015.7358837,crossref,learning robot manipulation from human video,concept,human_data,,3,robot manipulation; skill learning,2026-06-12T15:07:36Z,19.293,19.293
doi:10.1109/iros.2018.8593359,Effects of Integrated Intent Recognition and Communication on Human-Robot Collaboration,"Human-robot interaction research to date has investigated intent recognition and communication separately. In this paper, we explore the effects of integrating both the robot's ability to generate intentional motion and predict the human's motion in a collaborative physical task. We implemented an intent recognition system to recognize the human partner's hand motion intent and a motion planner system to enable the robot to communicate its intent by using legible and predictable motion. We tested this bi-directional intent system in a 2-way within-subjects user study. Results suggest that an integrated intent recognition and communication system may facilitate more collaborative behavior among team members.",2018,,Mai Lee Chang; Reymundo A. Gutierrez; Priyanka Khante; Elaine Schaertl Short; Andrea L. Thomaz,10.1109/iros.2018.8593359,,https://doi.org/10.1109/iros.2018.8593359,openalex,robotics,concept,openalex_bulk_robotics,,25,human robot interaction,2026-06-12T18:57:17Z,19.279,19.279
doi:10.1109/tro.2020.2971415,Quantifying Hypothesis Space Misspecification in Learning From Human–Robot Demonstrations and Physical Corrections,,2020,IEEE Transactions on Robotics,Andreea Bobu; Andrea Bajcsy; Jaime F. Fisac; Sampada Deglurkar; Anca D. Dragan,10.1109/tro.2020.2971415,,https://doi.org/10.1109/tro.2020.2971415,crossref,contact dynamics robot learning,concept,contact,,25,contact dynamics,2026-06-12T15:07:36Z,19.229,19.229
doi:10.1109/icra40945.2020.9197220,Shared Autonomous Interface for Reducing Physical Effort in Robot Teleoperation via Human Motion Mapping,,2020,2020 IEEE International Conference on Robotics and Automation (ICRA),Tsung-Chi Lin; Achyuthan Unni Krishnan; Zhi Li,10.1109/icra40945.2020.9197220,,https://doi.org/10.1109/icra40945.2020.9197220,crossref,teleoperation data robot foundation model,concept,human_data,,25,robot foundation model; teleoperation,2026-06-12T15:07:36Z,19.229,19.229
arxiv:2606.12604v1,EgoEngine: From Egocentric Human Videos to High-Fidelity Dexterous Robot Demonstrations,"Dexterous manipulation is limited by the cost of collecting large-scale robot demonstrations. Egocentric human videos offer a scalable source of diverse manipulation behaviors, but directly using them for robot learning requires bridging two gaps: the visual gap between human and robot observations, and the action gap between human motion and robot-executable action. We propose EgoEngine, a scalable framework for transforming egocentric human manipulation videos into high-fidelity robot data. Given an egocentric RGB video, EgoEngine produces: (i) a high-fidelity robot observation video replacing human with robot while preserving scene context and temporal alignment, and (ii) a task-aligned, executable robot action trajectory under feasibility constraints. Experiments in simulation and on real robots show that EgoEngine enables scalable conversion of human videos into robot data and, to o",2026,arXiv,Yangcen Liu; Shuo Cheng; Xinchen Yin; Woo Chul Shin; Alfred Cueva; Yiran Yang; Zhenyang Chen; Chuye Zhang; Danfei Xu,,2606.12604v1,http://arxiv.org/abs/2606.12604v1,arxiv,Gaussian splatting robot perception dexterous manipulation,concept,architecture_x_embodiment,,,Gaussian splatting robot perception; dexterous manipulation,2026-06-12T15:07:36Z,19.200,19.200
doi:10.1109/cvpr52688.2022.01956,Learning Video Representations of Human Motion from Synthetic Data,,2022,2022 IEEE/CVF Conference on Computer Vision and Pattern Recognition (CVPR),Xi Guo; Wei Wu; Dongliang Wang; Jing Su; Haisheng Su; Weihao Gan; Jian Huang; Qin Yang,10.1109/cvpr52688.2022.01956,,https://doi.org/10.1109/cvpr52688.2022.01956,crossref,learning robot manipulation from human video,concept,human_data,,10,robot manipulation,2026-06-12T15:07:36Z,19.199,19.199
doi:10.24963/ijcai.2018/105,Human Motion Generation via Cross-Space Constrained Sampling,"We aim to automatically generate human motion sequence from a single input person image, with some specific action label. To this end, we propose a cross-space human motion video generation network which features two paths: a forward path that first samples/generates a sequence of low dimensional motion vectors based on Gaussian Process (GP), which is paired with the input person image to form a moving human figure sequence; and a backward path based on the predicted human images to re-extract the corresponding latent motion representations. As lack of supervision, the reconstructed latent motion representations are expected to be as close as possible to the GP sampled ones, thus yielding a cyclic objective function for cross-space (i.e., motion and appearance) mutual constrained generation. We further propose an alternative sampling/generation algorithm with respect to constraints from ",2018,Proceedings of the Twenty-Seventh International Joint Conference on Artificial Intelligence,Zhongyue Huang; Jingwei Xu; Bingbing Ni,10.24963/ijcai.2018/105,,https://doi.org/10.24963/ijcai.2018/105,crossref,sampling based motion planning,anti_myopia,anti_thesis,,6,motion planning; sampling based motion planning,2026-06-12T15:07:36Z,19.173,23.173
doi:10.1109/icra.2011.5980468,The Motion Grammar for physical human-robot games,"We introduce the Motion Grammar, a powerful new representation for robot decision making, and validate its properties through the successful implementation of a physical human-robot game. The Motion Grammar is a formal tool for task decomposition and hybrid control in the presence of significant online uncertainty. In this paper, we describe the Motion Grammar, introduce some of the formal guarantees it can provide, and represent the entire game of human-robot chess through a single formal language. This language includes game-play, safe handling of human motion, uncertainty in piece positions, misplaced and collapsed pieces. We demonstrate the simple and effective language formulation through experiments on a 14-DOF manipulator interacting with 32 objects (chess pieces) and an unpredictable human adversary.",2011,,Neil T. Dantam; Pushkar Kolhe; Mike Stilman,10.1109/icra.2011.5980468,,https://doi.org/10.1109/icra.2011.5980468,openalex,robotics,concept,openalex_bulk_robotics,,18,,2026-06-12T18:57:17Z,19.172,20.172
doi:10.48550/arxiv.2205.12256,Differentiable Dynamics for Articulated 3d Human Motion Reconstruction,"We introduce DiffPhy, a differentiable physics-based model for articulated 3d human motion reconstruction from video. Applications of physics-based reasoning in human motion analysis have so far been limited, both by the complexity of constructing adequate physical models of articulated human motion, and by the formidable challenges of performing stable and efficient inference with physics in the loop. We jointly address such modeling and inference challenges by proposing an approach that combines a physically plausible body representation with anatomical joint limits, a differentiable physics simulator, and optimization techniques that ensure good performance and robustness to suboptimal local optima. In contrast to several recent methods, our approach readily supports full-body contact including interactions with objects in the scene. Most importantly, our model connects end-to-end wit",2022,arXiv (Cornell University),Erik Gärtner; Mykhaylo Andriluka; Erwin Coumans; Cristian Sminchisescu,10.48550/arxiv.2205.12256,,https://doi.org/10.48550/arxiv.2205.12256,openalex,energy based transformer robot policy,concept,ebm_transformer,,3,energy based transformer robot policy; benchmark; robustness,2026-06-12T18:05:07Z,19.143,21.143
doi:10.3390/s23249780,Human–Robot Interaction Using Learning from Demonstrations and a Wearable Glove with Multiple Sensors,"Human–robot interaction is of the utmost importance as it enables seamless collaboration and communication between humans and robots, leading to enhanced productivity and efficiency. It involves gathering data from humans, transmitting the data to a robot for execution, and providing feedback to the human. To perform complex tasks, such as robotic grasping and manipulation, which require both human intelligence and robotic capabilities, effective interaction modes are required. To address this issue, we use a wearable glove to collect relevant data from a human demonstrator for improved human–robot interaction. Accelerometer, pressure, and flexi sensors were embedded in the wearable glove to measure motion and force information for handling objects of different sizes, materials, and conditions. A machine learning algorithm is proposed to recognize grasp orientation and position, based on",2023,Sensors,Rajmeet Singh; Saeed Mozaffari; Masoud Akhshik; Mohammed Jalal Ahamed; Simon Rondeau-Gagné; Shahpour Alirezaee,10.3390/s23249780,,https://doi.org/10.3390/s23249780,crossref,learning robot manipulation from human video,concept,human_data,,9,robot manipulation; human robot interaction,2026-06-12T15:07:36Z,19.051,19.051
doi:10.1109/tnnls.2021.3131154,Effects of Motion-Relevant Knowledge From Unlabeled Video to Human–Object Interaction Detection,,2023,IEEE Transactions on Neural Networks and Learning Systems,Xue Lin; Qi Zou; Xixia Xu; Yaping Huang; Ding Ding,10.1109/tnnls.2021.3131154,,https://doi.org/10.1109/tnnls.2021.3131154,crossref,learning robot manipulation from human video,concept,human_data,,4,robot manipulation,2026-06-12T15:07:36Z,19.005,19.005
title:synthesizing robotic handwriting motion by learning from human demonstrations,Synthesizing robotic handwriting motion by learning from human demonstrations,"This paper contributes a novel framework that enables a robotic agent to efficiently learn and synthesize believable handwriting motion. We situate the framework as a foundation with the goal of allowing children to observe, correct and engage with the robot to learn themselves the handwriting skill. The framework adapts the principle behind ensemble methods - where improved performance is obtained by combining the output of multiple simple algorithms - in an inverse optimal control problem. This integration addresses the challenges of rapid extraction and representation of multiple-mode motion trajectories, with the cost forms which are transferable and interpretable in the development of the robot compliance control. It also introduces the incorporation of a human movement inspired feature, which provides intuitive motion modulation to generalize the synthesis with poor robotic written",2016,Repositório do ISCTE-IUL,Hang Yin; Patrícia Alves‐Oliveira; Francisco S. Melo; Aude Billard; Ana Paiva,,,https://openalex.org/W2472506550,openalex,robotics,concept,openalex_bulk_robotics,,17,human demonstration,2026-06-12T18:57:17Z,18.995,19.995
doi:10.1109/icra.2015.7139504,Control of generalized contact motion and force in physical human-robot interaction,,2015,2015 IEEE International Conference on Robotics and Automation (ICRA),Emanuele Magrini; Fabrizio Flacco; Alessandro De Luca,10.1109/icra.2015.7139504,,https://doi.org/10.1109/icra.2015.7139504,crossref,contact dynamics robot learning,concept,contact,,117,contact dynamics; human robot interaction,2026-06-12T15:07:36Z,18.985,18.985
doi:10.1007/978-981-96-3519-1_29,Exploring Human Attribution of Emotional Intent to Motion Features in a Humanoid Robot,,2025,Lecture Notes in Computer Science Social Robotics,Marieke van Otterdijk; Margot Neggers; Jim Torresen; Emilia Barakova,10.1007/978-981-96-3519-1_29,,https://doi.org/10.1007/978-981-96-3519-1_29,crossref,EBM transformer robotics humanoid robot,concept,architecture_x_embodiment,,1,EBM transformer robotics; humanoid robot,2026-06-12T15:07:36Z,18.947,18.947
doi:10.1049/cit2.12331,Transfer force perception skills to robot‐assisted laminectomy via imitation learning from human demonstrations,"Abstract A comparative study of two force perception skill learning approaches for robot‐assisted spinal surgery, the impedance model method and the imitation learning (IL) method, is presented. The impedance model method develops separate models for the surgeon and patient, incorporating spring‐damper and bone‐grinding models. Expert surgeons' feature parameters are collected and mapped using support vector regression and image navigation techniques. The imitation learning approach utilises long short‐term memory networks (LSTM) and addresses accurate data labelling challenges with custom models. Experimental results demonstrate skill recognition rates of 63.61%–74.62% for the impedance model approach, relying on manual feature extraction. Conversely, the imitation learning approach achieves a force perception recognition rate of 91.06%, outperforming the impedance model on curved bone ",2024,CAAI Transactions on Intelligence Technology,Meng Li; Xiaozhi Qi; Xiaoguang Han; Ying Hu; Bing Li; Yu Zhao; Jianwei Zhang,10.1049/cit2.12331,,https://doi.org/10.1049/cit2.12331,crossref,learning robot manipulation from human video,concept,human_data,,9,robot manipulation; skill learning; imitation learning; human demonstration,2026-06-12T15:07:36Z,18.901,18.901
doi:10.1109/case49997.2022.9926652,Adaptive Quasi-Static Motion Control of a Soft Robotic Exo-Digit in physical Human-Wearable-Soft-Robot-Interaction,,2022,2022 IEEE 18th International Conference on Automation Science and Engineering (CASE),Mahdi Haghshenas-Jaryani,10.1109/case49997.2022.9926652,,https://doi.org/10.1109/case49997.2022.9926652,crossref,Gaussian splatting robot perception soft robot manipulation,concept,architecture_x_embodiment,,5,Gaussian splatting robot perception; robot manipulation; soft robot manipulation,2026-06-12T15:07:36Z,18.896,18.896
doi:10.1155/2018/4160652,Recurrent Transformation of Prior Knowledge Based Model for Human Motion Recognition,"Motion related human activity recognition using wearable sensors can potentially enable various useful daily applications. So far, most studies view it as a stand-alone mathematical classification problem without considering the physical nature and temporal information of human motions. Consequently, they suffer from data dependencies and encounter the curse of dimension and the overfitting issue. Their models are hard to be intuitively understood. Given a specific motion set, if structured domain knowledge could be manually obtained, it could be used for better recognizing certain motions. In this study, we start from a deep analysis on natural physical properties and temporal recurrent transformation possibilities of human motions and then propose a useful Recurrent Transformation Prior Knowledge-based Decision Tree (RT-PKDT) model for recognition of specific human motions. RT-PKDT uti",2018,Computational Intelligence and Neuroscience,Cheng Xu; Jie He; Xiaotong Zhang; Haipiao Cai; Shihong Duan; Po‐Hsuan Tseng; Chong Li,10.1155/2018/4160652,,https://doi.org/10.1155/2018/4160652,openalex,energy based model robot learning,concept,ebm,,11,,2026-06-12T18:26:24Z,18.892,18.892
arxiv:2501.03515v1,Effects of Robot Competency and Motion Legibility on Human Correction Feedback,"As robot deployments become more commonplace, people are likely to take on the role of supervising robots (i.e., correcting their mistakes) rather than directly teaching them. Prior works on Learning from Corrections (LfC) have relied on three key assumptions to interpret human feedback: (1) people correct the robot only when there is significant task objective divergence; (2) people can accurately predict if a correction is necessary; and (3) people trade off precision and physical effort when giving corrections. In this work, we study how two key factors (robot competency and motion legibility) affect how people provide correction feedback and their implications on these existing assumptions. We conduct a user study ($N=60$) under an LfC setting where participants supervise and correct a robot performing pick-and-place tasks. We find that people are more sensitive to suboptimal behavio",2025,arXiv,Shuangge Wang; Anjiabei Wang; Sofiya Goncharova; Brian Scassellati; Tesca Fitzgerald,,2501.03515v1,http://arxiv.org/abs/2501.03515v1,arxiv,learning robot manipulation from human video,concept,human_data,,,robot manipulation; deployment,2026-06-12T14:45:03Z,18.850,19.850
