uid,title,abstract,year,venue,authors,doi,arxiv_id,url,source,query,query_role,family,advisor_seed,citation_count,matched_terms,retrieved_at,relevance_score,hostile_score
arxiv:2505.20537v2,CoRI: Communication of Robot Intent for Physical Human-Robot Interaction,"Clear communication of robot intent fosters transparency and interpretability in physical human-robot interaction (pHRI), particularly during assistive tasks involving direct human-robot contact. We introduce CoRI, a pipeline that automatically generates natural language communication of a robot's upcoming actions directly from its motion plan and visual perception. Our pipeline first processes the robot's image view to identify human poses and key environmental features. It then encodes the planned 3D spatial trajectory (including velocity and force) onto this view, visually grounding the path and its dynamics. CoRI queries a vision-language model with this visual representation to interpret the planned action within the visual context before generating concise, user-directed statements, without relying on task-specific information. Results from a user study involving robot-assisted fee",2025,arXiv,Junxiang Wang; Emek Barış Küçüktabak; Rana Soltani Zarrin; Zackory Erickson,,2505.20537v2,http://arxiv.org/abs/2505.20537v2,arxiv,adaptive world action model robot,concept,wam,,,world action model; adaptive world action model; human robot interaction,2026-06-12T14:45:03Z,24.550,24.550
doi:10.3389/fnbot.2022.826410,A Bio-Inspired Mechanism for Learning Robot Motion From Mirrored Human Demonstrations,"Different learning modes and mechanisms allow faster and better acquisition of skills as widely studied in humans and many animals. Specific neurons, called mirror neurons, are activated in the same way whether an action is performed or simply observed. This suggests that observing others performing movements allows to reinforce our motor abilities. This implies the presence of a biological mechanism that allows creating models of others' movements and linking them to the self-model for achieving mirroring. Inspired by such ability, we propose to build a map of movements executed by a teaching agent and mirror the agent's state to the robot's configuration space. Hence, in this study, a neural network is proposed to integrate a motor cortex-like differential map transforming motor plans from task-space to joint-space motor commands and a static map correlating joint-spaces of the robot a",2022,Frontiers in Neurorobotics,Omar Zahra; Silvia Tolu; Peng Zhou; Anqing Duan; David Navarro-Alarcon,10.3389/fnbot.2022.826410,,https://doi.org/10.3389/fnbot.2022.826410,crossref,learning robot manipulation from human video,concept,human_data,,16,robot manipulation; human demonstration,2026-06-12T15:07:36Z,23.767,23.767
doi:10.1007/s12555-025-0505-8,REPLAY: Robot Embodiment via Intent-aware Policy Imitation by Replicating Human Demonstrations From Video,,2025,"International Journal of Control, Automation and Systems",Sung-Gil Park; Han-Byeol Kim; Yong-Geon Kim; Seuk-Woo Ryu; Byeong-Gil Yoo; Sungeun Chung; Yong-Jun Lee; Jeong-Seop Park; Woo-Jin Ahn; Myo-Taeg Lim,10.1007/s12555-025-0505-8,,https://doi.org/10.1007/s12555-025-0505-8,crossref,learning robot manipulation from human video,concept,human_data,,,robot manipulation; human demonstration,2026-06-12T15:07:36Z,23.600,23.600
doi:10.1109/roman.2018.8525727,Andorid Robot Motion Generation Based on Video-Recorded Human Demonstrations,,2018,2018 27th IEEE International Symposium on Robot and Human Interactive Communication (RO-MAN),Dae-Seong Go; Hyun-Jun Hyung; Dong-Wook Lee; Han Ul Yoon,10.1109/roman.2018.8525727,,https://doi.org/10.1109/roman.2018.8525727,crossref,learning robot manipulation from human video,concept,human_data,,4,robot manipulation; human demonstration,2026-06-12T14:45:03Z,23.005,23.005
doi:10.1145/3623384,"Unified Learning from Demonstrations, Corrections, and Preferences during Physical Human–Robot Interaction","Humans can leverage physical interaction to teach robot arms. This physical interaction takes multiple forms depending on the task, the user, and what the robot has learned so far. State-of-the-art approaches focus on learning from a single modality, or combine some interaction types. Some methods do so by assuming that the robot has prior information about the features of the task and the reward structure. By contrast, in this article, we introduce an algorithmic formalism that unites learning from demonstrations, corrections, and preferences. Our approach makes no assumptions about the tasks the human wants to teach the robot; instead, we learn a reward model from scratch by comparing the human’s input to nearby alternatives, i.e., trajectories close to the human’s feedback. We first derive a loss function that trains an ensemble of reward models to match the human’s demonstrations, co",2024,ACM Transactions on Human-Robot Interaction,Shaunak A. Mehta; Dylan P. Losey,10.1145/3623384,,https://doi.org/10.1145/3623384,crossref,learning robot manipulation from human video,concept,human_data,,18,robot manipulation; human robot interaction,2026-06-12T14:45:03Z,22.922,22.922
doi:10.1007/s10514-021-10030-9,User intent estimation during robot learning using physical human robot interaction primitives,"Abstract As robotic systems transition from traditional setups to collaborative work spaces, the prevalence of physical Human Robot Interaction has risen in both industrial and domestic environments. A popular representation for robot behavior is movement primitives which learn, imitate, and generalize from expert demonstrations. While there are existing works in context-aware movement primitives, they are usually limited to contact-free human robot interactions. This paper presents physical Human Robot Interaction Primitives (pHRIP), which utilize only the interaction forces between the human user and robot to estimate user intent and generate the appropriate robot response during physical human robot interactions. The efficacy of pHRIP is evaluated through multiple experiments based on target-directed reaching and obstacle avoidance tasks using a real seven degree of freedom robot arm.",2022,Autonomous Robots,Yujun Lai; Gavin Paul; Yunduan Cui; Takamitsu Matsubara,10.1007/s10514-021-10030-9,,https://doi.org/10.1007/s10514-021-10030-9,crossref,energy based model robot learning,concept,ebm,,13,human robot interaction,2026-06-12T15:07:36Z,22.720,22.720
doi:10.3389/frobt.2024.1312554,Multimodal fusion of EMG and vision for human grasp intent inference in prosthetic hand control,"Objective: For transradial amputees, robotic prosthetic hands promise to regain the capability to perform daily living activities. Current control methods based on physiological signals such as electromyography (EMG) are prone to yielding poor inference outcomes due to motion artifacts, muscle fatigue, and many more. Vision sensors are a major source of information about the environment state and can play a vital role in inferring feasible and intended gestures. However, visual evidence is also susceptible to its own artifacts, most often due to object occlusion, lighting changes, etc. Multimodal evidence fusion using physiological and vision sensor measurements is a natural approach due to the complementary strengths of these modalities. Methods: In this paper, we present a Bayesian evidence fusion framework for grasp intent inference using eye-view video, eye-gaze, and EMG from the for",2024,Frontiers in Robotics and AI,Mehrshad Zandigohar; Mo Han; Mohammadreza Sharif; Sezen Yağmur Günay; Mariusz P. Furmanek; Mathew Yarossi; Paolo Bonato; Cagdas Onal; Taşkın Padır; Deniz Erdoğmuş; Gunar Schirner,10.3389/frobt.2024.1312554,,https://doi.org/10.3389/frobt.2024.1312554,crossref,EBM transformer robotics robot hand,concept,architecture_x_embodiment,,44,EBM transformer robotics; robot hand; occlusion,2026-06-12T15:07:36Z,22.703,22.703
doi:10.2174/0126662558278156231231063935,Motion Signal-based Recognition of Human Activity from Video Stream Dataset Using Deep Learning Approach,"Background: Human physical activity recognition is challenging in various research eras, such as healthcare, surveillance, senior monitoring, athletics, and rehabilitation. The use of various sensors has attracted outstanding research attention due to the implementation of machine learning and deep learning approaches. Aim: This paper proposes a unique deep learning framework based on motion signals to recognize human activity to handle these constraints and challenges through deep learning (e.g., Enhance CNN, LR, RF, DT, KNN, and SVM) approaches. Method: This research article uses the BML (Biological Motion Library) dataset gathered from thirty volunteers with four various activities to analyze the performance metrics. It compares the evaluated results with existing results, which are found by machine learning and deep learning methods to identify human activity. Result: This framework ",2024,Recent Advances in Computer Science and Communications,Ram Kumar Yadav; Daniel Arockiam; Vijay Bhaskar Semwal,10.2174/0126662558278156231231063935,,https://doi.org/10.2174/0126662558278156231231063935,crossref,learning robot manipulation from human video,concept,human_data,,6,robot manipulation,2026-06-12T15:07:36Z,22.423,22.423
doi:10.3390/app15084186,Video Human Action Recognition Based on Motion-Tempo Learning and Feedback Attention,"In video human action-recognition tasks, motion tempo describes the dynamic patterns and temporal scales of human motion. Different categories of actions are typically composed of sub-actions with varying motion tempos. Effectively capturing sub-actions with different motion tempos and distinguishing category-specific sub-actions are crucial for improving action-recognition performance. Convolutional Neural Network (CNN)-based methods attempted to address this challenge, by embedding feedforward attention modules to enhance the action’s dynamic representation learning. However, feedforward attention modules rely only on local information from low-level features, lacking contextual information to generate attention weights. Therefore, we propose a Sub-action Motion information Enhancement Network (SMEN) based on motion-tempo learning and feedback attention, which consists of the Multi-Gra",2025,Applied Sciences,Yalong Liu; Chengwu Liang; Songqi Jiang; Peiwang Zhu,10.3390/app15084186,,https://doi.org/10.3390/app15084186,crossref,learning robot manipulation from human video,concept,human_data,,1,robot manipulation; ablation,2026-06-12T15:07:36Z,22.347,23.347
doi:10.1177/02783649211046285,Concept2Robot: Learning manipulation concepts from instructions and human demonstrations,"We aim to endow a robot with the ability to learn manipulation concepts that link natural language instructions to motor skills. Our goal is to learn a single multi-task policy that takes as input a natural language instruction and an image of the initial scene and outputs a robot motion trajectory to achieve the specified task. This policy has to generalize over different instructions and environments. Our insight is that we can approach this problem through learning from demonstration by leveraging large-scale video datasets of humans performing manipulation actions. Thereby, we avoid more time-consuming processes such as teleoperation or kinesthetic teaching. We also avoid having to manually design task-specific rewards. We propose a two-stage learning process where we first learn single-task policies through reinforcement learning. The reward is provided by scoring how well the robot",2021,The International Journal of Robotics Research,Lin Shao; Toki Migimatsu; Qiang Zhang; Karen Yang; Jeannette Bohg,10.1177/02783649211046285,,https://doi.org/10.1177/02783649211046285,crossref,learning robot manipulation from human video,concept,human_data,,68,robot manipulation; imitation learning; human demonstration; teleoperation; generalization,2026-06-12T15:07:36Z,21.967,22.967
doi:10.1109/icca.2019.8899490,Predicting Human Intent for Cooperative Physical Human-Robot Interaction Tasks,"In this paper, a robot assistive Impedance and Admittance control methodology is proposed for a cooperative physical human-robot interaction (pHRI) task. In a pHRI task in which the human is the leader, the robot is a passive follower as the human intention of desired motion and force to be applied are unknown. It is generally difficult to predict the intention of the human leader. Recurrent Neural Networks (RNN) with Long Short-Term Memory (LSTM) units are employed to forecast the position,velocity and force anticipated to be applied by the human. The estimated parameters are integrated into the impedance and admittance controllers via a target impedance model which aids the robot in becoming a proactive partner of the human by sharing the physical load. The same methodology is also applied to the Minimum Jerk model which allows the robot to follow the Minimum Jerk trajectory without kn",2019,,Harsh Maithani; Juan Antonio Corrales Ramón; Youcef Mezouar,10.1109/icca.2019.8899490,,https://doi.org/10.1109/icca.2019.8899490,openalex,robotics,concept,openalex_bulk_robotics,,16,human robot interaction,2026-06-12T18:57:17Z,21.917,21.917
doi:10.1109/tro.2016.2540623,Learning Physical Collaborative Robot Behaviors From Human Demonstrations,,2016,IEEE Transactions on Robotics,Leonel Rozo; Sylvain Calinon; Darwin G. Caldwell; Pablo Jimenez; Carme Torras,10.1109/tro.2016.2540623,,https://doi.org/10.1109/tro.2016.2540623,crossref,learning robot manipulation from human video,concept,human_data,,272,robot manipulation; human demonstration,2026-06-12T14:45:03Z,21.605,21.605
arxiv:2603.03243v2,HoMMI: Learning Whole-Body Mobile Manipulation from Human Demonstrations,"We present Whole-Body Mobile Manipulation Interface (HoMMI), a data collection and policy learning framework that learns whole-body mobile manipulation directly from robot-free human demonstrations. We augment UMI interfaces with egocentric sensing to capture the global context required for mobile manipulation, enabling portable, robot-free, and scalable data collection. However, naively incorporating egocentric sensing introduces a larger human-to-robot embodiment gap in both observation and action spaces, making policy transfer difficult. We explicitly bridge this gap with a cross-embodiment hand-eye policy design, including an embodiment agnostic visual representation; a relaxed head action representation; and a whole-body controller that realizes hand-eye trajectories through coordinated whole-body motion under robot-specific physical constraints. Together, these enable long-horizon ",2026,arXiv,Xiaomeng Xu; Jisang Park; Han Zhang; Eric Cousineau; Aditya Bhat; Jose Barreiros; Dian Wang; Jeannette Bohg; Shuran Song,,2603.03243v2,http://arxiv.org/abs/2603.03243v2,arxiv,whole body manipulation humanoid,concept,humanoid,,,mobile manipulation; active perception; human demonstration; long horizon,2026-06-12T14:45:03Z,21.550,21.550
doi:10.1109/lra.2024.3418275,Aligning Human Intent From Imperfect Demonstrations With Confidence-Based Inverse Soft-Q Learning,,2024,IEEE Robotics and Automation Letters,Xizhou Bu; Wenjuan Li; Zhengxiong Liu; Zhiqiang Ma; Panfeng Huang,10.1109/lra.2024.3418275,,https://doi.org/10.1109/lra.2024.3418275,crossref,learning robot manipulation from human video,concept,human_data,,4,robot manipulation,2026-06-12T15:07:36Z,21.205,21.205
arxiv:2604.24681v2,Learning Human-Intention Priors from Large-Scale Human Demonstrations for Robotic Manipulation,"Human videos contain rich manipulation priors, but using them for robot learning remains difficult because raw observations entangle scene understanding, human motion, and embodiment-specific action. We introduce MoT-HRA, a hierarchical vision-language-action framework that learns human-intention priors from large-scale human demonstrations. We first curate HA-2.2M, a 2.2M-episode action-language dataset reconstructed from heterogeneous human videos through hand-centric filtering, spatial reconstruction, temporal segmentation, and language alignment. On top of this dataset, MoT-HRA factorizes manipulation into three coupled experts: a vision-language expert predicts an embodiment-agnostic 3D trajectory, an intention expert models MANO-style hand motion as a latent human-motion prior, and a fine expert maps the intention-aware representation to robot action chunks. A shared-attention trun",2026,arXiv,Yifan Xie; YuAn Wang; Guangyu Chen; Jinkun Liu; Yu Sun; Wenbo Ding,,2604.24681v2,http://arxiv.org/abs/2604.24681v2,arxiv,learning robot manipulation from human video,concept,human_data,,,robot manipulation; human demonstration; distribution shift,2026-06-12T14:45:03Z,21.200,21.200
arxiv:2605.20373v1,SUGAR: A Scalable Human-Video-Driven Generalizable Humanoid Loco-Manipulation Learning Framework,"Building humanoid robots capable of generalizable whole-body loco-manipulation in the real world remains a fundamental challenge. Existing methods either rely on laborious task-specific reward engineering, rigidly replay reference motions that fail to generalize, or depend on costly teleoperation that limits scalability. While human videos capture diverse human behaviors, motion priors inferred from them are inherently imperfect, suffering from occlusion, contact artifacts, and retargeting errors that render them unsuitable for direct policy learning. To address this, we present SUGAR, a scalable data-driven framework that converts diverse human videos into deployable humanoid loco-manipulation skills, without any task-specific reward engineering or reference-motion conditioning at inference. SUGAR proceeds in three stages. First, a fully automated pipeline extracts kinematic interaction",2026,arXiv,Tianshu Wu; Xiangqi Kong; Yue Chen; Qize Yu; Hang Ye; Jia Li; Yizhou Wang; Hao Dong,,2605.20373v1,http://arxiv.org/abs/2605.20373v1,arxiv,humanoid robot foundation model,concept,humanoid,,,robot foundation model; humanoid robot; teleoperation; occlusion; long horizon,2026-06-12T14:45:03Z,21.200,22.200
doi:10.1115/1.4039145,"A Review of Intent Detection, Arbitration, and Communication Aspects of Shared Control for Physical Human–Robot Interaction","As robotic devices are applied to problems beyond traditional manufacturing and industrial settings, we find that interaction between robots and humans, especially physical interaction, has become a fast developing field. Consider the application of robotics in healthcare, where we find telerobotic devices in the operating room facilitating dexterous surgical procedures, exoskeletons in the rehabilitation domain as walking aids and upper-limb movement assist devices, and even robotic limbs that are physically integrated with amputees who seek to restore their independence and mobility. In each of these scenarios, the physical coupling between human and robot, often termed physical human robot interaction (pHRI), facilitates new human performance capabilities and creates an opportunity to explore the sharing of task execution and control between humans and robots. In this review, we provi",2018,Applied Mechanics Reviews,Dylan P. Losey; Craig G. McDonald; Edoardo Battaglia; Marcia K. O’Malley,10.1115/1.4039145,,https://doi.org/10.1115/1.4039145,openalex,energy based model robot learning,concept,ebm,,373,human robot interaction,2026-06-12T18:05:07Z,20.912,20.912
title:adamorph unified motion retargeting via embodiment aware adaptive transformers,AdaMorph: Unified Motion Retargeting via Embodiment-Aware Adaptive Transformers,"Retargeting human motion to heterogeneous robots is a fundamental challenge in robotics, primarily due to the severe kinematic and dynamic discrepancies between varying embodiments. Existing solutions typically resort to training embodiment-specific models, which scales poorly and fails to exploit shared motion semantics. To address this, we present AdaMorph, a unified neural retargeting framework that enables a single model to adapt human motion to diverse robot morphologies. Our approach treats retargeting as a conditional generation task. We map human motion into a morphology-agnostic latent intent space and utilize a dual-purpose prompting mechanism to condition the generation. Instead of simple input concatenation, we leverage Adaptive Layer Normalization (AdaLN) to dynamically modulate the decoder's feature space based on embodiment constraints. Furthermore, we enforce physical pla",2026,ArXiv.org,Haoyu Zhang; Shibo Jin; Lvsong Li; Jun Li; Liang Lin; Xiaodong He; Zecui Zeng,,,https://openalex.org/W7124118478,openalex,energy based transformer robot policy,concept,ebm_transformer,,,energy based transformer robot policy; humanoid robot; generalization,2026-06-12T18:05:07Z,20.750,21.750
doi:10.1109/tcds.2023.3241632,Applied Exoskeleton Technology: A Comprehensive Review of Physical and Cognitive Human–Robot Interaction,"Exoskeletons and orthoses are wearable mobile systems providing mechanical benefits to users. Despite significant improvements in the last decades, the technology is not fully mature to be adopted for strenuous and nonprogrammed tasks. To accommodate this insufficiency, different aspects of this technology need to be analyzed and improved. Numerous studies have tried to address some aspects of exoskeletons, e.g., mechanism design, intent prediction, and control scheme. However, most works have focused on a specific element of design or application without providing a comprehensive review framework. This study aims to analyze and survey the contributing aspects to this technology’s improvement and broad adoption. To address this, after introducing assistive devices and exoskeletons, the main design criteria will be investigated from both physical human–robot interaction (HRI) perspectives",2023,IEEE Transactions on Cognitive and Developmental Systems,Farhad Nazari; Navid Mohajer; Darius Nahavandi; Abbas Khosravi; Saeid Nahavandi,10.1109/tcds.2023.3241632,,https://doi.org/10.1109/tcds.2023.3241632,openalex,robotics,concept,openalex_bulk_robotics,,42,human robot interaction; limitation,2026-06-12T18:57:17Z,20.531,21.531
doi:10.3390/app11125651,Variable Admittance Control Based on Trajectory Prediction of Human Hand Motion for Physical Human-Robot Interaction,"In order to achieve effective physical human–robot interaction, human dynamic characteristics needs to be considered in admittance control. This paper proposes a variable admittance control method for physical human–robot interaction based on trajectory prediction of human hand motion. By predicting the moving direction of the robot end tool under human guidance, the admittance control parameters are adjusted to reduce the interaction force. The end tool trajectory of the robot under human guidance is used for offline training of long and short-term memory neural network to generate trajectory predictors. Then the trajectory predictors are used in variable admittance control to predict the trajectory and movement direction of the robot end tool in real time. The variable admittance controller adjusts the damping matrix to reduce the damping value in the moving direction. Experiment resul",2021,Applied Sciences,Yu Wang; Yuanyuan Yang; Baoliang Zhao; Xiaozhi Qi; Ying Hu; Bing Li; Lining Sun; Lihai Zhang; Max Q.-H. Meng,10.3390/app11125651,,https://doi.org/10.3390/app11125651,crossref,trajectory transformer robot control,concept,transformers,,24,trajectory transformer; human robot interaction; benchmark,2026-06-12T15:07:36Z,20.459,21.459
arxiv:2101.07241v2,Learning by Watching: Physical Imitation of Manipulation Skills from Human Videos,"Learning from visual data opens the potential to accrue a large range of manipulation behaviors by leveraging human demonstrations without specifying each of them mathematically, but rather through natural task specification. In this paper, we present Learning by Watching (LbW), an algorithmic framework for policy learning through imitation from a single video specifying the task. The key insights of our method are two-fold. First, since the human arms may not have the same morphology as robot arms, our framework learns unsupervised human to robot translation to overcome the morphology mismatch issue. Second, to capture the details in salient regions that are crucial for learning state representations, our model performs unsupervised keypoint detection on the translated robot videos. The detected keypoints form a structured representation that contains semantically meaningful information",2021,arXiv,Haoyu Xiong; Quanzhou Li; Yun-Chun Chen; Homanga Bharadhwaj; Samarth Sinha; Animesh Garg,,2101.07241v2,http://arxiv.org/abs/2101.07241v2,arxiv,learning robot manipulation from human video,concept,human_data,,,robot manipulation; human demonstration,2026-06-12T14:45:03Z,20.400,20.400
doi:10.1145/3173386.3176955,Inertial Human Motion Estimation for Physical Human-Robot Interaction Using an Interaction Velocity Update to Reduce Drift,,2018,Companion of the 2018 ACM/IEEE International Conference on Human-Robot Interaction,Erik Kyrkjebø,10.1145/3173386.3176955,,https://doi.org/10.1145/3173386.3176955,crossref,learning robot manipulation from human video,concept,human_data,,9,robot manipulation; human robot interaction,2026-06-12T15:07:36Z,20.351,20.351
doi:10.1109/tase.2024.3415650,A Physical Human–Robot Interaction Framework for Trajectory Adaptation Based on Human Motion Prediction and Adaptive Impedance Control,,2025,IEEE Transactions on Automation Science and Engineering,Jing Luo; Chaoyi Zhang; Weiyong Si; Yiming Jiang; Chenguang Yang; Chao Zeng,10.1109/tase.2024.3415650,,https://doi.org/10.1109/tase.2024.3415650,crossref,trajectory transformer robot control,concept,transformers,,31,trajectory transformer; impedance control; human robot interaction,2026-06-12T15:07:36Z,20.333,20.333
