uid,title,abstract,year,venue,authors,doi,arxiv_id,url,source,query,query_role,family,advisor_seed,citation_count,matched_terms,retrieved_at,relevance_score,hostile_score
doi:10.3389/fnbot.2022.860981,Applying Deep Learning-Based Human Motion Recognition System in Sports Competition,"The exploration here intends to compensate for the traditional human motion recognition (HMR) systems' poor performance on large-scale datasets and micromotions. To this end, improvement is designed for the HMR in sports competition based on the deep learning (DL) algorithm. First, the background and research status of HMR are introduced. Then, a new HMR algorithm is proposed based on kernel extreme learning machine (KELM) multidimensional feature fusion (MFF). Afterward, a simulation experiment is designed to evaluate the performance of the proposed KELM-MFF-based HMR algorithm. The results showed that the recognition rate of the proposed KELM-MFF-based HMR is higher than other algorithms. The recognition rate at 10 video frame sampling points is ranked from high to low: the proposed KELM-MFF-based HMR, support vector machine (SVM)-MFF-based HMR, convolutional neural network (CNN) + opt",2022,Frontiers in Neurorobotics,Liangliang Zhang,10.3389/fnbot.2022.860981,,https://doi.org/10.3389/fnbot.2022.860981,openalex,energy based model robot learning,concept,ebm,,24,,2026-06-12T18:26:24Z,17.709,17.709
doi:10.3390/s100201154,Machine Learning Methods for Classifying Human Physical Activity from On-Body Accelerometers,"The use of on-body wearable sensors is widespread in several academic and industrial domains. Of great interest are their applications in ambulatory monitoring and pervasive computing systems; here, some quantitative analysis of human motion and its automatic classification are the main computational tasks to be pursued. In this paper, we discuss how human physical activity can be classified using on-body accelerometers, with a major emphasis devoted to the computational algorithms employed for this purpose. In particular, we motivate our current interest for classifiers based on Hidden Markov Models (HMMs). An example is illustrated and discussed by analysing a dataset of accelerometer time series.",2010,Sensors,Andrea Mannini; A.M. Sabatini,10.3390/s100201154,,https://doi.org/10.3390/s100201154,openalex,energy based model robot learning,concept,ebm,,777,,2026-06-12T18:05:07Z,17.700,17.700
doi:10.1109/iros.2008.4650764,Collision Detection and Reaction: A Contribution to Safe Physical Human-Robot Interaction,"In the framework of physical Human-Robot Interaction (pHRI), methodologies and experimental tests are presented for the problem of detecting and reacting to collisions between a robot manipulator and a human being. Using a lightweight robot that was especially designed for interactive and cooperative tasks, we show how reactive control strategies can significantly contribute to ensuring safety to the human during physical interaction. Several collision tests were carried out, illustrating the feasibility and effectiveness of the proposed approach. While a subjective “safety” feeling is experienced by users when being able to naturally stop the robot in autonomous motion, a quantitative analysis of different reaction strategies was lacking. In order to compare these strategies on an objective basis, a mechanical verification platform has been built. The proposed collision detection and re",2008,,Sami Haddadin; Alin Albu‐Schäffer; Alessandro De Luca; Gerd Hirzinger,10.1109/iros.2008.4650764,,https://doi.org/10.1109/iros.2008.4650764,openalex,robotics,concept,openalex_bulk_robotics,,560,human robot interaction,2026-06-12T18:57:17Z,17.700,17.700
doi:10.1371/journal.pone.0061691,Separating Movement and Gravity Components in an Acceleration Signal and Implications for the Assessment of Human Daily Physical Activity,"INTRODUCTION: Human body acceleration is often used as an indicator of daily physical activity in epidemiological research. Raw acceleration signals contain three basic components: movement, gravity, and noise. Separation of these becomes increasingly difficult during rotational movements. We aimed to evaluate five different methods (metrics) of processing acceleration signals on their ability to remove the gravitational component of acceleration during standardised mechanical movements and the implications for human daily physical activity assessment. METHODS: An industrial robot rotated accelerometers in the vertical plane. Radius, frequency, and angular range of motion were systematically varied. Three metrics (Euclidian norm minus one [ENMO], Euclidian norm of the high-pass filtered signals [HFEN], and HFEN plus Euclidean norm of low-pass filtered signals minus 1 g [HFEN+]) were deri",2013,PLoS ONE,Vincent T. van Hees; Lukas Gorzelniak; Emmanuel Dean‐Leon; M. Eder; Marcelo Pias; Salman Taherian; Ulf Ekelund; Frida Renström; Paul W. Franks; Alexander Horsch; Søren Brage,10.1371/journal.pone.0061691,,https://doi.org/10.1371/journal.pone.0061691,openalex,robotics,concept,openalex_bulk_robotics,,948,industrial robot,2026-06-12T18:57:17Z,17.700,17.700
doi:10.1109/tcsvt.2021.3057992,Survey on Mapping Human Hand Motion to Robotic Hands for Teleoperation,"Mapping human hand motion to robotic hands has great significance in a wide range of applications, such as teleoperation and imitation learning. The ultimate goal is to develop a device-independent control solution based on human hand synergies. Over the past twenty years, a considerable number of mapping methods have been proposed, but most of the mapping methods use intrusive devices, such as the CyberGlove data gloves, to capture human hand motion. Until recently, a very small number of mapping methods have been proposed based on vision-based human hand pose estimation. Traditionally, mapping methods and vision-based human hand pose estimation have been studied independently. To the best of our knowledge, no review has been conducted to summarize the achievements on haptic mapping methods or explore the feasibility of applying off-the-shelf human hand pose estimation algorithms to tel",2021,IEEE Transactions on Circuits and Systems for Video Technology,Rui Li; Hongyu Wang; Zhenyu Liu,10.1109/tcsvt.2021.3057992,,https://doi.org/10.1109/tcsvt.2021.3057992,openalex,robotics,concept,openalex_bulk_robotics,,72,imitation learning; teleoperation,2026-06-12T18:57:17Z,17.695,17.695
doi:10.1177/1729881421998585,A Human-like Upper-limb Motion Planner: Generating naturalistic movements for humanoid robots,"As robots are starting to become part of our daily lives, they must be able to cooperate in a natural and efficient manner with humans to be socially accepted. Human-like morphology and motion are often considered key features for intuitive human–robot interactions because they allow human peers to easily predict the final intention of a robotic movement. Here, we present a novel motion planning algorithm, the Human-like Upper-limb Motion Planner, for the upper limb of anthropomorphic robots, that generates collision-free trajectories with human-like characteristics. Mainly inspired from established theories of human motor control, the planning process takes into account a task-dependent hierarchy of spatial and postural constraints modelled as cost functions. For experimental validation, we generate arm-hand trajectories in a series of tasks including simple point-to-point reaching move",2021,International Journal of Advanced Robotic Systems,Gianpaolo Gulletta; Eliana Costa e Silva; Wolfram Erlhagen; Ruud G. J. Meulenbroek; M. Fernanda P. Costa; Estela Bicho,10.1177/1729881421998585,,https://doi.org/10.1177/1729881421998585,openalex,robotics,concept,openalex_bulk_robotics,,35,humanoid robot; motion planning; human robot interaction,2026-06-12T18:57:17Z,17.692,18.692
doi:10.1109/tcds.2018.2866477,Biologically Inspired Motion Modeling and Neural Control for Robot Learning From Demonstrations,"In this paper, we propose a biologically inspired framework for robot learning based on demonstrations. The dynamic movement primitive (DMP), which is motivated by neurobiology and human behavior, is employed to model a robotic motion that is generalizable. However, the DMP method can only be used to handle a single demonstration. To enable the robot to learn from multiple demonstrations, the DMP is combined with the Gaussian mixture model (GMM) to integrate the features of multiple demonstrations, where the conventional GMM is further replaced by the fuzzy GMM (FGMM) to improve the fitting performance. Also, a novel regression algorithm for FGMM is derived to retrieve the nonlinear term of the DMP. Additionally, a neural network-based controller is developed for the robot to track the generated motions. In this network, the cerebellar model articulation controller is employed to compens",2018,IEEE Transactions on Cognitive and Developmental Systems,Chenguang Yang; Chuize Chen; Ning Wang; Zhaojie Ju; Jian Fu; Min Wang,10.1109/tcds.2018.2866477,,https://doi.org/10.1109/tcds.2018.2866477,openalex,robotics,concept,openalex_bulk_robotics,,109,,2026-06-12T18:57:17Z,17.650,17.650
doi:10.1142/s0219843606000813,HUMAN MOTION PERCEPTION THROUGH VIDEO MODEL-BASED TRACKING,"As computer vision enables the robot to be aware of its human counterpart, such algorithms could help machines to achieve human-like interaction. However, many video tracking algorithms are not able to cope with some robot vision requirements. The articulated tracking system we develop solves some of those issues. It relies on model-based algorithms, which we believe are more suitable to robot vision than appearance-based ones. Indeed, as they update all the relevant parameters of a surrounding world model, results include some knowledge of the camera and objects relative positions. Our system relies on 3D model silhouette matching and runs in real time. We increase the algorithm robustness by introducing a pre-processing step based on image moments. This allows the iteration refinement to start in a better position by roughly estimating the body motion from one frame to the next.",2006,International Journal of Humanoid Robotics,JEAN-BAPTISTE DE LA RIVIÈRE; PASCAL GUITTON,10.1142/s0219843606000813,,https://doi.org/10.1142/s0219843606000813,crossref,humanoid robot foundation model,concept,humanoid,,,robot foundation model; humanoid robot; robustness,2026-06-12T14:45:03Z,17.650,18.650
doi:10.1108/ir-07-2025-0249,Dynamic human-like motion planning method of human–robot collaboration based on movement primitives and double DQN,"Purpose The purpose of this paper is to address the low acceptance and declining collaborative willingness caused by hard-to-understand, unpredictable robot motions and neglected human feelings in physical human–robot collaborative motion (pHRCM). To this end, this paper proposes a dynamic human-like motion planning (DHMP) method based on movement primitives and double deep Q-network (DQN). Design/methodology/approach In the method, the data sets of physical human–human collaborative motion (pHHCM) and pHRCM are established, and the human arm movement primitives of pHHCM are analyzed. On this basis, a double DQN model based on long short-term memory (LSTM) is established. The model can autonomously decide the primitives type based on perceiving and understanding the collaborator’s motion. Then, a DHMP method, including admittance control, movement primitives decision-making, primitives p",2025,Industrial Robot: the international journal of robotics research and application,Chengyun Wang; Tingting Zhang,10.1108/ir-07-2025-0249,,https://doi.org/10.1108/ir-07-2025-0249,crossref,robot world model failure planning,hostile,failure,,,robot world model; motion planning; robot world model failure,2026-06-12T15:07:36Z,17.650,22.650
doi:10.1109/icra.2018.8460651,Anticipating Many Futures: Online Human Motion Prediction and Generation for Human-Robot Interaction,"Fluent and safe interactions of humans and robots require both partners to anticipate the others' actions. The bottleneck of most methods is the lack of an accurate model of natural human motion. In this work, we present a conditional variational autoencoder that is trained to predict a window of future human motion given a window of past frames. Using skeletal data obtained from RGB depth images, we show how this unsupervised approach can be used for online motion prediction for up to 1660 ms. Additionally, we demonstrate online target prediction within the first 300-500 ms after motion onset without the use of target specific training data. The advantage of our probabilistic approach is the possibility to draw samples of possible future motion patterns. Finally, we investigate how movements and kinematic cues are represented on the learned low dimensional manifold.",2018,,Judith Bütepage; Hedvig Kjellström; Danica Kragić,10.1109/icra.2018.8460651,,https://doi.org/10.1109/icra.2018.8460651,openalex,robotics,concept,openalex_bulk_robotics,,108,human robot interaction,2026-06-12T18:57:17Z,17.646,17.646
doi:10.1109/tmech.2022.3155601,Cooperative Transportation With Mobile Manipulator: A Capability Map-Based Framework for Physical Human–Robot Collaboration,"In the cooperative transportation task with a mobile manipulator (MM), the mobile robot and the manipulator must move simultaneously to adapt to the human motion. In addition, the motion of the MM is underconstrained due to redundancy, which makes MM real-time motion planning challenging. In this article, a capability map-based framework was proposed to enable real-time motion planning of the MM. In the motion planner, the dexterity of the MM, the formation of the human–robot system, and obstacle avoidance of the mobile robot are considered to get safe and human-like robot motion. Moreover, to make optimization faster and avoid local minimum, capability map, which represents the manipulability distribution of the MM in its workspace, is queried to determine the seed of the optimization algorithm. The proposed motion planner is self-contained and can be extended to the transportation task",2022,IEEE/ASME Transactions on Mechatronics,Heng Zhang; Sheng Qi; Jiawei Hu; Xinjun Sheng; Zhenhua Xiong; Xiangyang Zhu,10.1109/tmech.2022.3155601,,https://doi.org/10.1109/tmech.2022.3155601,openalex,robotics,concept,openalex_bulk_robotics,,41,motion planning,2026-06-12T18:57:17Z,17.619,18.619
doi:10.1186/s12984-017-0247-9,Physical interface dynamics alter how robotic exosuits augment human movement: implications for optimizing wearable assistive devices,"BACKGROUND: Wearable assistive devices have demonstrated the potential to improve mobility outcomes for individuals with disabilities, and to augment healthy human performance; however, these benefits depend on how effectively power is transmitted from the device to the human user. Quantifying and understanding this power transmission is challenging due to complex human-device interface dynamics that occur as biological tissues and physical interface materials deform and displace under load, absorbing and returning power. METHODS: Here we introduce a new methodology for quickly estimating interface power dynamics during movement tasks using common motion capture and force measurements, and then apply this method to quantify how a soft robotic ankle exosuit interacts with and transfers power to the human body during walking. We partition exosuit end-effector power (i.e., power output from",2017,Journal of NeuroEngineering and Rehabilitation,Matthew B. Yandell; Brendan Quinlivan; Dmitry Popov; Conor J. Walsh; Karl E. Zelik,10.1186/s12984-017-0247-9,,https://doi.org/10.1186/s12984-017-0247-9,openalex,energy based policy robotics,concept,ebm,,152,,2026-06-12T18:05:07Z,17.615,17.615
doi:10.3390/robotics13020027,A Novel Approach to Simulating Realistic Exoskeleton Behavior in Response to Human Motion,"Simulation models are a valuable tool for exoskeleton development, especially for system optimization and evaluation. It allows an assessment of the performance and effectiveness of exoskeletons even at an early stage of their development without physical realization. Due to the closed physical interaction between the exoskeleton and the user, accurate modeling of the human–exoskeleton interaction in defined scenarios is essential for exoskeleton simulations. This paper presents a novel approach to simulate exoskeleton motion in response to human motion and the interaction forces at the physical interfaces between the human and the exoskeleton. Our approach uses a multibody model of a shoulder exoskeleton in MATLAB R2021b and imports human motion via virtual markers from a digital human model to simulate human–exoskeleton interaction. To validate the human-motion-based approach, simulate",2024,Robotics,Zhejun Yao; Seyed Milad Mir Latifi; Carla Molz; David Scherb; Christopher Löffelmann; Johannes Sänger; Jörg Miehling; Sandro Wartzack; Andreas Lindenmann; Sven Matthiesen; Robert Weidner,10.3390/robotics13020027,,https://doi.org/10.3390/robotics13020027,crossref,robotics,concept,crossref_bulk_robotics,,9,,2026-06-12T19:29:26Z,17.601,18.601
doi:10.5772/4728,"Bio-Mimetic Finger: Human Like Morphology, Control &amp; Motion Planning for Intelligent Robot &amp; Prosthesis",,2006,"Mobile Robotics, Moving Intelligence",Emanuele Lindo; Giovanni Magenes,10.5772/4728,,https://doi.org/10.5772/4728,crossref,robot world model failure planning,hostile,failure,,,robot world model; motion planning; robot world model failure,2026-06-12T15:07:36Z,17.600,22.600
doi:10.3389/frobt.2023.1152595,Interactively learning behavior trees from imperfect human demonstrations,"Introduction: In Interactive Task Learning (ITL), an agent learns a new task through natural interaction with a human instructor. Behavior Trees (BTs) offer a reactive, modular, and interpretable way of encoding task descriptions but have not yet been applied a lot in robotic ITL settings. Most existing approaches that learn a BT from human demonstrations require the user to specify each action step-by-step or do not allow for adapting a learned BT without the need to repeat the entire teaching process from scratch. Method: We propose a new framework to directly learn a BT from only a few human task demonstrations recorded as RGB-D video streams. We automatically extract continuous pre- and post-conditions for BT action nodes from visual features and use a Backchaining approach to build a reactive BT. In a user study on how non-experts provide and vary demonstrations, we identify three c",2023,Frontiers in Robotics and AI,Lisa Scherf; Aljoscha Schmidt; Suman Pal; Dorothea Koert,10.3389/frobt.2023.1152595,,https://doi.org/10.3389/frobt.2023.1152595,crossref,learning robot manipulation from human video,concept,human_data,,13,robot manipulation; human demonstration,2026-06-12T15:07:36Z,17.570,17.570
doi:10.1061/9780784483893.132,Worker-in-the-Loop Cyber-Physical System for Safe Human-Robot Collaboration in Construction,"Efficient implementation of robots in dynamic, human-populated construction sites will require the assistance and supervision of workers. Several hazards exist when workers are within the robots’ working envelope, including high mental stress induced by the robot as well as the risk of physical collision. To mitigate these risks, this study proposes a cyber-physical system (CPS) for safe, worker-centered human-robot collaboration (HRC). The physical components of the CPS include a wearable biosensor for assessing workers’ mental conditions and a video camera for evaluating the risk of collision accidents. The cyber component incorporates a machine learning layer that employs a kernelized logistic regression to translate worker bio-signals into distinct physiological states. Simultaneously, the system monitors the relative distance between workers and robots by applying computer vision te",2022,Computing in Civil Engineering 2021,Yizhi Liu; Mahmoud Habibnezhad; Houtan Jebelli; Vishal Monga,10.1061/9780784483893.132,,https://doi.org/10.1061/9780784483893.132,openalex,robotics,concept,openalex_bulk_robotics,,17,,2026-06-12T18:57:17Z,17.545,17.545
doi:10.9781/ijimai.2017.447,A Depth Video-based Human Detection and Activity Recognition using Multi-features and Embedded Hidden Markov Models for Health Care Monitoring Systems,"Increase in number of elderly people who are living independently needs especial care in the form of healthcare monitoring systems. Recent advancements in depth video technologies have made human activity recognition (HAR) realizable for elderly healthcare applications. In this paper, a depth video-based novel method for HAR is presented using robust multi-features and embedded Hidden Markov Models (HMMs) to recognize daily life activities of elderly people living alone in indoor environment such as smart homes. In the proposed HAR framework, initially, depth maps are analyzed by temporal motion identification method to segment human silhouettes from noisy background and compute depth silhouette area for each activity to track human movements in a scene. Several representative features, including invariant, multi-view differentiation and spatiotemporal body joints features were fused tog",2017,International Journal of Interactive Multimedia and Artificial Intelligence,Ahmad Jalal; Shaharyar Kamal; Daijin Kim,10.9781/ijimai.2017.447,,https://doi.org/10.9781/ijimai.2017.447,openalex,energy based model robot learning,concept,ebm,,123,,2026-06-12T18:05:07Z,17.510,17.510
doi:10.1109/tcst.2023.3338112,Physical Human–Robot Interaction Control of an Upper Limb Exoskeleton With a Decentralized Neuroadaptive Control Scheme,"Within the concept of physical human–robot interaction (pHRI), the paramount criterion is the safety of the human operator interacting with a high-degree-of-freedom (DoF) robot. Consequently, there is a substantial demand for a robust control scheme to establish safe pHRI and stabilize nonlinear, high DoF systems. In this article, an adaptive decentralized control strategy is designed to accomplish the abovementioned objectives. A human upper limb model and an exoskeleton model are decentralized and augmented at the subsystem level to enable decentralized control action design. Human exogenous torque (HET), which can resist exoskeleton motion, is estimated using radial basis function neural networks (RBFNNs). Estimating human upper limb and robot rigid body parameters, as well as HET, makes the controller adaptable to different operators, ensuring their physical safety during the interac",2023,IEEE Transactions on Control Systems Technology,Mahdi Hejrati; Jouni Mattila,10.1109/tcst.2023.3338112,,https://doi.org/10.1109/tcst.2023.3338112,openalex,energy based model robot learning,concept,ebm,,10,human robot interaction; robustness,2026-06-12T18:26:24Z,17.499,18.499
doi:10.1109/aim46487.2021.9517438,Intention-Driven Variable Impedance Control for Physical Human-Robot Interaction,"The technology of physical human-robot interaction (pHRI) aims to combine the advantages of both humans and robots, and it is now playing a significant role in many industrial and medical applications. However, the open issues of safety and efficiency have not been systematically addressed for pHRI. In this paper, a new intention-driven variable impedance controller is proposed for compliantly-driven robots, where the robot is controlled to track the estimated human motion intention under a variable desired impedance model. The human motion intention is represented with the desired angle of the human limb and approximated with adaptive neural networks (NNs). Then, the impedance parameters are adjusted online according to the offset between the desired angle and the current joint configuration of the robot. Such a formulation allows the robot to predict human behavior for better collabora",2021,,Yingxin Huo; Xiang Li; Xuan Zhang; Dong Sun,10.1109/aim46487.2021.9517438,,https://doi.org/10.1109/aim46487.2021.9517438,openalex,robotics,concept,openalex_bulk_robotics,,22,impedance control; human robot interaction,2026-06-12T18:57:17Z,17.468,17.468
doi:10.1109/tro.2022.3190217,Characterizing Multidimensional Capacitive Servoing for Physical Human–Robot Interaction,"Toward the goal of robots performing robust and intelligent physical interactions with people, it is crucial that robots are able to accurately sense the human body, follow trajectories around the body, and track human motion. This study introduces a capacitive servoing control scheme that allows a robot to sense and navigate around human limbs during close physical interactions. Capacitive servoing leverages temporal measurements from a multielectrode capacitive sensor array mounted on a robot's end effector to estimate the relative position and orientation (pose) of a nearby human limb. Capacitive servoing then uses these human pose estimates from a data-driven pose estimator within a feedback control loop in order to maneuver the robot's end effector around the surface of a human limb. We provide a design overview of capacitive sensors for human–robot interaction and then investigate ",2022,IEEE Transactions on Robotics,Zackory Erickson; Henry Clever; Vamsee Gangaram; Eliot Xing; Greg Turk; C. Karen Liu; Charles C. Kemp,10.1109/tro.2022.3190217,,https://doi.org/10.1109/tro.2022.3190217,openalex,robotics,concept,openalex_bulk_robotics,,14,human robot interaction; generalization,2026-06-12T18:57:17Z,17.454,18.454
