uid,title,abstract,year,venue,authors,doi,arxiv_id,url,source,query,query_role,family,advisor_seed,citation_count,matched_terms,retrieved_at,relevance_score,hostile_score
doi:10.3390/machines14020249,Force Sensing Control for Physical Human–Robot Interaction: A Transformer-Based Action Chunking Approach,"In human–robot collaboration (HRC) scenarios with direct physical contact, accurately estimating human intentions and adjusting robot behaviors based on multimodal information is the core factors that restrict the efficiency and precision of current HRC tasks. To enhance the performance of human–robot collaboration under physical contact conditions, we propose a joint network model named ACT_force_cooperative (AFC). This model leverages force sensing information as a representation of human intent to achieve human intent prediction during physical interaction, while simultaneously capturing visual information and robot state data, thereby enabling more efficient execution of human–robot collaborative tasks with multimodal information processing. Existing HRC methods often ignore humans’ collaborative experience in the environment and fail to recognize the uniqueness of interactive force ",2026,Machines,Zhenyu Pan; Weiming Wang,10.3390/machines14020249,,https://doi.org/10.3390/machines14020249,crossref,energy based transformer robot policy,concept,ebm_transformer,,1,energy based transformer robot policy; human robot interaction,2026-06-12T14:45:03Z,16.997,16.997
doi:10.1371/journal.pone.0340390,SkelFormer: An adaptive hierarchical transformer-based approach on skeleton graphs for human action recognition in video sequences,"Human skeleton-based action recognition represents a pivotal field of study, capturing the intricate interplay between physical dynamics and intentional actions. Current research primarily focuses on extracting structural and temporal information from static skeleton-based graphs, but it grapples with a myriad of challenges. These include 1) an absence of hierarchical structure in encoding the skeleton-based graphs. 2) A requirement for substantial prior knowledge to interpret the diverse spatial dynamics within singular action labels. 3) An intricate task of representing the multifaceted temporal dynamics of individual actions. To address these challenges, we propose SkelFormer, a novel framework that captures spatiotemporal variations in skeleton-based graphs extracted from video sequences. The proposed SkelFormer incorporates the SKT Block as a central element, effectively facilitatin",2026,PLOS One,Jiexing Yan; Xi Zhang; Caiyan Tan; Dawen Li,10.1371/journal.pone.0340390,,https://doi.org/10.1371/journal.pone.0340390,crossref,action transformer,concept,architecture,,1,action transformer; benchmark,2026-06-12T14:45:03Z,16.997,17.997
doi:10.1007/s10846-025-02333-1,Human-Robot Interaction with Skeleton-Based Action Recognition and Motion Prediction,"Abstract Human-robot interaction (HRI) is inherently challenging due to the dynamic and unpredictable nature of human motion, which complicates the determination of appropriate timing and location for interaction. To address this challenge, we propose a novel framework that integrates skeleton-based action recognition with motion prediction, enabling safe and adaptive trajectory generation. Action recognition is used to determine when to interact, while motion prediction is used to determine where to interact. Since human actions inherently influence subsequent motion patterns, the combination of these two components yields a more comprehensive understanding of human intent, thereby improving both prediction accuracy and interaction timing. A dual-level deep learning architecture is introduced to implement the proposed method. The high-level module performs human action recognition for i",2025,Journal of Intelligent & Robotic Systems,Fan Zeng; Yusheng Wang; Masahiro Nishio; Jun Ota,10.1007/s10846-025-02333-1,,https://doi.org/10.1007/s10846-025-02333-1,crossref,adaptive world action model robot,concept,wam,,1,world action model; adaptive world action model; robot hand; human robot interaction,2026-06-12T15:07:36Z,16.997,16.997
doi:10.15588/1607-3274-2026-1-3,DEEP LEARNING MODELS FOR PREDICTING HUMAN MOVEMENT IN VIDEO STREAMS,"Context. The problem of accurately predicting human movement in an environment is critical for applications in monitoring, search, and navigation systems. Existing approaches often struggle to integrate spatial and temporal dynamics of trajectories while processing real-time video streams.Objective. The goal of this work is to develop a deep learning-based framework capable of predicting human motion by combining object-level features and spatio-temporal trajectory information extracted from video streams.Method. The proposed method integrates YOLO11 for object detection, which extracts coordinates, velocity, movement direction, and position relative to the environment. A graph neural network models local and global relationships between environment nodes, aggregating features while considering terrain structure and obstacles. Spatio-temporal attention highlights the most relevant moment",2026,"Radio Electronics, Computer Science, Control",N. V. Bilous; V. O. Ivanichev,10.15588/1607-3274-2026-1-3,,https://doi.org/10.15588/1607-3274-2026-1-3,crossref,learning robot manipulation from human video,concept,human_data,,1,robot manipulation,2026-06-12T15:07:36Z,16.997,16.997
doi:10.1111/cgf.15282,THGS: Lifelike Talking Human Avatar Synthesis From Monocular Video Via 3D Gaussian Splatting,"Abstract Despite the remarkable progress in 3D talking head generation, directly generating 3D talking human avatars still suffers from rigid facial expressions, distorted hand textures and out‐of‐sync lip movements. In this paper, we extend speaker‐specific talking head generation task to talking human avatar synthesis and propose a novel pipeline, THGS , that animates lifelike Talking Human avatars using 3D Gaussian Splatting (3DGS). Given speech audio, expression and body poses as input, THGS effectively overcomes the limitations of 3DGS human re‐construction methods in capturing expressive dynamics, such as mouth movements, facial expressions and hand gestures , from a short monocular video. Firstly, we introduce a simple yet effective Learnable Expression Blendshapes (LEB) for facial dynamics re‐construction, where subtle facial dynamics can be generated by linearly combining the st",2025,Computer Graphics Forum,Chuang Chen; Lingyun Yu; Quanwei Yang; Aihua Zheng; Hongtao Xie,10.1111/cgf.15282,,https://doi.org/10.1111/cgf.15282,crossref,Gaussian splatting robot perception,concept,architecture,,1,Gaussian splatting robot perception; limitation,2026-06-12T15:07:36Z,16.997,17.997
doi:10.3390/biomimetics10060399,Bio-Signal-Guided Robot Adaptive Stiffness Learning via Human-Teleoperated Demonstrations,"Robot learning from human demonstration pioneers an effective mapping paradigm for endowing robots with human-like operational capabilities. This paper proposes a bio-signal-guided robot adaptive stiffness learning framework grounded in the conclusion that muscle activation of the human arm is positively correlated with the endpoint stiffness. First, we propose a human-teleoperated demonstration platform enabling real-time modulation of robot end-effector stiffness by human tutors during operational tasks. Second, we develop a dual-stage probabilistic modeling architecture employing the Gaussian mixture model and Gaussian mixture regression to model the temporal–motion correlation and the motion–sEMG relationship, successively. Third, a real-world experiment was conducted to validate the effectiveness of the proposed skill transfer framework, demonstrating that the robot achieves online ",2025,Biomimetics,Wei Xia; Zhiwei Liao; Zongxin Lu; Ligang Yao,10.3390/biomimetics10060399,,https://doi.org/10.3390/biomimetics10060399,crossref,adaptive world action model robot,concept,wam,,3,world action model; adaptive world action model; online adaptation; human demonstration,2026-06-12T15:07:36Z,16.993,17.993
doi:10.1109/tnsre.2020.2987878,Active Intent Disambiguation for Shared Control Robots,"Assistive shared-control robots have the potential to transform the lives of millions of people afflicted with severe motor impairments. The usefulness of shared-control robots typically relies on the underlying autonomy's ability to infer the user's needs and intentions, and the ability to do so unambiguously is often a limiting factor for providing appropriate assistance confidently and accurately. The contributions of this paper are four-fold. First, we introduce the idea of intent disambiguation via control mode selection, and present a mathematical formalism for the same. Second, we develop a control mode selection algorithm which selects the control mode in which the user-initiated motion helps the autonomy to maximally disambiguate user intent. Third, we present a pilot study with eight subjects to evaluate the efficacy of the disambiguation algorithm. Our results suggest that the",2020,IEEE Transactions on Neural Systems and Rehabilitation Engineering,Deepak Gopinath; Brenna Argall,10.1109/tnsre.2020.2987878,,https://doi.org/10.1109/tnsre.2020.2987878,openalex,robotics,concept,openalex_bulk_robotics,,12,,2026-06-12T18:57:17Z,16.982,16.982
doi:10.1016/j.sna.2022.114149,Multi-responsive soft actuator with integrated ultrasensitive sensing performances for human motion detection and soft robots,,2023,Sensors and Actuators A Physical,Ling Li; Guangwen Jia; Wenwei Huang; Jiayi Zhou; Chenxing Li; Jingxuan Han; Yan Zhang; Xuejiao Zhou,10.1016/j.sna.2022.114149,,https://doi.org/10.1016/j.sna.2022.114149,openalex,robotics,concept,openalex_bulk_robotics,,30,,2026-06-12T18:57:17Z,16.967,16.967
doi:10.3390/s21124012,How Imitation Learning and Human Factors Can Be Combined in a Model Predictive Control Algorithm for Adaptive Motion Planning and Control,"Interest in autonomous vehicles (AVs) has significantly increased in recent years, but despite the huge research efforts carried out in the field of intelligent transportation systems (ITSs), several technological challenges must still be addressed before AVs can be extensively deployed in any environment. In this context, one of the key technological enablers is represented by the motion-planning and control system, with the aim of guaranteeing the occupants comfort and safety. In this paper, a trajectory-planning and control algorithm is developed based on a Model Predictive Control (MPC) approach that is able to work in different road scenarios (such as urban areas and motorways). This MPC is designed considering imitation-learning from a specific dataset (from real-world overtaking maneuver data), with the aim of getting human-like behavior. The algorithm is used to generate optimal ",2021,Sensors,Milad Karimshoushtari; Carlo Novara; Fabio Tango,10.3390/s21124012,,https://doi.org/10.3390/s21124012,crossref,embodied world model planning control,concept,world_models,,8,model predictive control; motion planning; imitation learning,2026-06-12T15:07:36Z,16.949,19.949
doi:10.1109/ism.2014.31,Music Driven Human Motion Manipulation for Characters in a Video,,2014,2014 IEEE International Symposium on Multimedia,Che-Hua Yeh; Yi-Hsuan Yang; Ming-Hsu Chang; Hong-Yuan Mark Liao,10.1109/ism.2014.31,,https://doi.org/10.1109/ism.2014.31,crossref,learning robot manipulation from human video,concept,human_data,,1,robot manipulation,2026-06-12T15:07:36Z,16.947,16.947
doi:10.1007/978-0-85729-057-1_9,Video-Based Human Motion Estimation by Part-Whole Gait Manifold Learning,,2011,Advances in Pattern Recognition Machine Learning for Vision-Based Motion Analysis,Guoliang Fan; Xin Zhang,10.1007/978-0-85729-057-1_9,,https://doi.org/10.1007/978-0-85729-057-1_9,crossref,learning robot manipulation from human video,concept,human_data,,1,robot manipulation,2026-06-12T15:07:36Z,16.947,16.947
doi:10.20965/ijat.2023.p0277,Inflatable Humanoid Cybernetic Avatar for Physical Human–Robot Interaction,"In a digital twin, a humanoid robot can be the counterpart of a simulated agent in the real world. In addition, a human, virtual avatar, and avatar robot might constitute digital triplets. We propose an inflatable cybernetic avatar (CA) with a humanoid upper body using an inflatable structure that can represent gestures. This inflatable CA is much lighter, safer, and cheaper than conventional humanoid robots and can be folded when deflated. These properties are ideal for physical human–robot interaction (pHRI) and allow real-time collection of human behavior through interaction. In the experiment, basic movements such as nodding and raising arms were measured using motion capture systems. This paper demonstrates the proposed inflatable CA in a hybrid event. We also conducted an experiment to measure the touch interactions using tactile sensors attached to the fabric of the inflatable par",2023,International Journal of Automation Technology,Ryuma Niiyama; Masahiro Ikeda; Young Ah Seong,10.20965/ijat.2023.p0277,,https://doi.org/10.20965/ijat.2023.p0277,crossref,humanoid robot foundation model,concept,humanoid,,3,robot foundation model; humanoid robot; human robot interaction,2026-06-12T15:07:36Z,16.943,17.943
doi:10.1109/tvcg.2023.3308753,Machine Learning Approaches for 3D Motion Synthesis and Musculoskeletal Dynamics Estimation: A Survey,"The inference of 3D motion and dynamics of the human musculoskeletal system has traditionally been solved using physics-based methods that exploit physical parameters to provide realistic simulations. Yet, such methods suffer from computational complexity and reduced stability, hindering their use in computer graphics applications that require real-time performance. With the recent explosion of data capture (mocap, video) machine learning (ML) has started to become popular as it is able to create surrogate models harnessing the huge amount of data stemming from various sources, minimizing computational time (instead of resource usage), and most importantly, approximate real-time solutions. The main purpose of this paper is to provide a review and classification of the most recent works regarding motion prediction, motion synthesis as well as musculoskeletal dynamics estimation problems u",2023,IEEE Transactions on Visualization and Computer Graphics,Iliana Loi; Evangelia I. Zacharaki; Κωνσταντίνος Μουστάκας,10.1109/tvcg.2023.3308753,,https://doi.org/10.1109/tvcg.2023.3308753,openalex,energy based transformer robot policy,concept,ebm_transformer,,12,energy based transformer robot policy,2026-06-12T18:05:07Z,16.932,16.932
doi:10.1109/tmech.2021.3057022,A Constrained DMPs Framework for Robot Skills Learning and Generalization From Human Demonstrations,,2021,IEEE/ASME Transactions on Mechatronics,Zhenyu Lu; Ning Wang; Chenguang Yang,10.1109/tmech.2021.3057022,,https://doi.org/10.1109/tmech.2021.3057022,crossref,learning robot manipulation from human video,concept,human_data,,69,robot manipulation; human demonstration; generalization,2026-06-12T15:07:36Z,16.924,17.924
doi:10.1109/lra.2020.2969200,Benchmark for Human-to-Robot Handovers of Unseen Containers With Unknown Filling,"The real-time estimation through vision of the physical properties of objects manipulated by humans is important to inform the control of robots for performing accurate and safe grasps of objects handed over by humans. However, estimating the 3D pose and dimensions of previously unseen objects using only RGB cameras is challenging due to illumination variations, reflective surfaces, transparencies, and occlusions caused both by the human and the robot. In this letter, we present a benchmark for dynamic human-to-robot handovers that do not rely on a motion capture system, markers, or prior knowledge of specific objects. To facilitate comparisons, the benchmark focuses on cups with different levels of transparencies and with an unknown amount of an unknown filling. The performance scores assess the overall system as well as its components in order to help isolate modules of the pipeline th",2020,IEEE Robotics and Automation Letters,Ricardo Sánchez-Matilla; Konstantinos Chatzilygeroudis; Apostolos Modas; Nuno Ferreira Duarte; Alessio Xompero; Pascal Frossard; Aude Billard; Andrea Cavallaro,10.1109/lra.2020.2969200,,https://doi.org/10.1109/lra.2020.2969200,openalex,robotics,concept,openalex_bulk_robotics,,41,robot hand; benchmark; occlusion,2026-06-12T18:57:17Z,16.919,17.919
doi:10.1109/tase.2018.2840345,Facilitating Human–Robot Collaborative Tasks by Teaching-Learning-Collaboration From Human Demonstrations,,2019,IEEE Transactions on Automation Science and Engineering,Weitian Wang; Rui Li; Yi Chen; Z. Max Diekel; Yunyi Jia,10.1109/tase.2018.2840345,,https://doi.org/10.1109/tase.2018.2840345,crossref,learning robot manipulation from human video,concept,human_data,,149,robot manipulation; human demonstration,2026-06-12T15:07:36Z,16.905,16.905
doi:10.1016/j.cirp.2018.04.066,Deep learning-based human motion recognition for predictive context-aware human-robot collaboration,,2018,CIRP Annals,Peng Wang; Hongyi Liu; Lihui Wang; Robert X. Gao,10.1016/j.cirp.2018.04.066,,https://doi.org/10.1016/j.cirp.2018.04.066,crossref,learning robot manipulation from human video,concept,human_data,,222,robot manipulation,2026-06-12T15:07:36Z,16.904,16.904
doi:10.3389/fnbot.2015.00003,Self-organizing neural integration of pose-motion features for human action recognition,"The visual recognition of complex, articulated human movements is fundamental for a wide range of artificial systems oriented toward human-robot communication, action classification, and action-driven perception. These challenging tasks may generally involve the processing of a huge amount of visual information and learning-based mechanisms for generalizing a set of training actions and classifying new samples. To operate in natural environments, a crucial property is the efficient and robust recognition of actions, also under noisy conditions caused by, for instance, systematic sensor errors and temporarily occluded persons. Studies of the mammalian visual system and its outperforming ability to process biological motion information suggest separate neural pathways for the distinct processing of pose and motion features at multiple levels and the subsequent integration of these visual c",2015,Frontiers in Neurorobotics,German I. Parisi; Cornelius Weber; Stefan Wermter,10.3389/fnbot.2015.00003,,https://doi.org/10.3389/fnbot.2015.00003,openalex,energy based model robot learning,concept,ebm,,80,benchmark,2026-06-12T18:26:24Z,16.897,17.897
doi:10.1145/3368854,Objective Assessment of Human Workload in Physical Human-robot Cooperation Using Brain Monitoring,"The notions of safe and compliant interaction are not sufficient to ensure effective physical human-robot cooperation. To obtain an optimal compliant behavior (e.g., variable impedance/admittance control), assessment techniques are required to measure the effectiveness of the interaction in terms of perceived workload by users. This study investigates electroencephalography (EEG) monitoring as an objective measure to classify workload in cooperative manipulation with compliance. An experimental study is conducted including two types of manipulation (gross and fine) with two admittance levels (low- and high-damping). Performance and self-reported measures indicate that a proper admittance level that enhances perceived workload is task-dependent. This information is used to form a binary classification problem (low- and high-workload) with spectral power density and coherence as the featur",2020,ACM Transactions on Human-Robot Interaction,Amirhossein H. Memar; Ehsan T. Esfahani,10.1145/3368854,,https://doi.org/10.1145/3368854,crossref,learning robot manipulation from human video,concept,human_data,,23,robot manipulation,2026-06-12T15:07:36Z,16.889,16.889
doi:10.1049/iet-cvi.2015.0416,Multi‐view human action recognition using 2D motion templates based on MHIs and their HOG description,"In this study, a new multi‐view human action recognition approach is proposed by exploiting low‐dimensional motion information of actions. Before feature extraction, pre‐processing steps are performed to remove noise from silhouettes, incurred due to imperfect, but realistic segmentation. Two‐dimensional motion templates based on motion history image (MHI) are computed for each view/action video. Histograms of oriented gradients (HOGs) are used as an efficient description of the MHIs which are classified using nearest neighbor (NN) classifier. As compared with existing approaches, the proposed method has three advantages: (i) does not require a fixed number of cameras setup during training and testing stages hence missing camera‐views can be tolerated, (ii) requires less memory and bandwidth requirements and hence (iii) is computationally efficient which makes it suitable for real‐time a",2016,IET Computer Vision,Fiza Murtaza; Muhammad Haroon Yousaf; Sergio A. Velastin,10.1049/iet-cvi.2015.0416,,https://doi.org/10.1049/iet-cvi.2015.0416,crossref,vision language action model,concept,architecture,,57,vision language action model,2026-06-12T15:07:36Z,16.880,16.880
doi:10.1109/humanoids.2014.7041470,"Master Motor Map (MMM) — Framework and toolkit for capturing, representing, and reproducing human motion on humanoid robots","We present an extended version of our work on the design and implementation of a reference model of the human body, the Master Motor Map (MMM) which should serve as a unifying framework for capturing human motions, their representation in standard data structures and formats as well as their reproduction on humanoid robots. The MMM combines the definition of a comprehensive kinematics and dynamics model of the human body with 104 DoF including hands and feet with procedures and tools for unified capturing of human motions. We present online motion converters for the mapping of human and object motions to the MMM model while taking into account subject specific anthropométrie data as well as for the mapping of MMM motion to a target robot kinematics. Experimental evaluation of the approach performed on VICON motion recordings demonstrate the benefits of the MMM as an important step toward",2014,,Ömer Terlemez; Stefan Ulbrich; Christian Mandery; Martin Do; Nikolaus Vahrenkamp; Tamim Asfour,10.1109/humanoids.2014.7041470,,https://doi.org/10.1109/humanoids.2014.7041470,openalex,robotics,concept,openalex_bulk_robotics,,77,humanoid robot,2026-06-12T18:57:17Z,16.878,17.878
doi:10.3389/frobt.2023.1151303,Interactive and incremental learning of spatial object relations from human demonstrations,"Humans use semantic concepts such as spatial relations between objects to describe scenes and communicate tasks such as “Put the tea to the right of the cup” or “Move the plate between the fork and the spoon.” Just as children, assistive robots must be able to learn the sub-symbolic meaning of such concepts from human demonstrations and instructions. We address the problem of incrementally learning geometric models of spatial relations from few demonstrations collected online during interaction with a human. Such models enable a robot to manipulate objects in order to fulfill desired spatial relations specified by verbal instructions. At the start, we assume the robot has no geometric model of spatial relations. Given a task as above, the robot requests the user to demonstrate the task once in order to create a model from a single demonstration, leveraging cylindrical probability distrib",2023,Frontiers in Robotics and AI,Rainer Kartmann; Tamim Asfour,10.3389/frobt.2023.1151303,,https://doi.org/10.3389/frobt.2023.1151303,crossref,learning robot manipulation from human video,concept,human_data,,6,robot manipulation; humanoid robot; assistive robot; human demonstration,2026-06-12T15:07:36Z,16.873,16.873
doi:10.1109/tsmc.2016.2531679,The Role of the Thumb: Study of Finger Motion in Grasping and Reachability Space in Human and Robotic Hands,"It is well acknowledged that the opposing thumb granted humans advanced manipulation capabilities. However, such a feature is not statistically quantified, and its representation is not formally addressed in robotics yet. This paper studies whether the displacement of the opposing thumb in humans is a determining factor for shaping the grip. Using statistical analysis of the variability of motion capture data from the GRASP database, we found that the displacement of the thumb plays a leading role on the shaping of the grip, independently from the specific object being grasped. Furthermore, we map and compare the reachability spaces of the human thumb and two state-of-the-art robotic thumbs: (1) the shadow and (2) the iCub hands. We conclude that the kinematics of robotic thumbs does not evenly span the reachability space of the human thumb, favoring precision grasping motions. Hence, ou",2016,IEEE Transactions on Systems Man and Cybernetics Systems,Giuseppe Cotugno; Kaspar Althoefer; Thrishantha Nanayakkara,10.1109/tsmc.2016.2531679,,https://doi.org/10.1109/tsmc.2016.2531679,openalex,robotics,concept,openalex_bulk_robotics,,50,,2026-06-12T18:57:17Z,16.866,16.866
